{"schemaVersion":1,"newEntries":5,"verb":"scan","startedAt":1791238324,"message":"Done \u2014 5 new, 0 cached, 3 skipped, 2 not in the database, 1 dumps RetroAchievements does not support","cachedHits":0,"unmatched":2,"jobId":"job1","incompatible":1,"progress":1,"skippedPlatforms":3,"status":"done","updatedAt":1791238324}